Comment,anti1,anti2,anti3,cent1,cent2,cent3,sov1,sov2,sov3,none1,none2,none3,Populism
"Man glaubt es nicht in den 20er Jahren hat Ford als erstes Unternehmen die 38 Stunden Woche eingeführt , heute müssen die Mitarbeiter bei schlecht Bezahlten Jobs  12 Stunden Arbeiten.
Wo sind die Gewerkschaften die endlich die Unternehmer / Kunden / Konsumenten bremsen.!!!!!",0,0,0,0,0,0,0,1,0,1,0,1,0
"Sofortiges Veranstaltungsverbot.
Maske in allen Geschäften. 
Abstandsregeln wieder strafbar. 

Anders gehts wohl nicht. Das wirkt. Aber die Wahl...! Maßnahmen von wem auch immer werden nur gesetzt wenn es politisch opportun ist.",1,1,1,0,0,0,0,0,0,0,0,0,1
Mit 600 Büchern zuhause geht glaube ich nicht viel kulturelles an ihm vorbei. Nicht jeder hat die selben Interessen wie Sie.,0,0,0,0,0,0,0,0,0,1,1,1,0
Also eine optische Täuschung durch die Nähe des Mondes zum Horizont. Das Phänomen ist seit 2000 Jahren bekannt. Schon die alten Griechen haben nachgemessen und die Täuschung durchschaut.,0,0,0,0,0,0,0,0,0,1,1,1,0
"Darf, darf, darf.. hey.. Tut was ihr tun wollt. Basta.
Ich werde doch sicher niemanden fragen was ich darf und was nicht. Ich bin ein erwachsener und gebildeter Mensch dieses Landes. Soweit kommt es noch. Ich tue was ich für richtig, und vor allem für gesund halte und MIT NORMALEM MENSCHENVERSTAND zu tun hat. Das sollte jeder andere auch machen.",0,0,0,0,0,0,0,0,0,1,1,1,0
"Die Mutter von einem Kollegen ist auch 1 Monat bevor Corona offiziell in Ö war,  nach einer Verkühlung, dann Lungenentzündung, Atemnot, künstliche Beamtung nach Intubation und endgültig an Nierenversagen gestorben. Hat sich so 3 bis 4 Wochen dahingezogen.",0,0,0,0,0,0,0,0,0,1,1,1,0
"Zu den 180 Mio. US-Dollar kamen noch einmal 270 Mio. US-Dollar für die Umsiedlung von dort lebenden Menschen dazu.

Ein Lerchalschass für so ein tolles Teleskop. Das es aber auch hier zu Zwangsumsiedlungen kam, ist der ungute Beigeschmack.

Was auch ein wenig seltsam ist, dass die chinesischen Lokalbehörden das Teleskop zur Touristenattraktion machen wollen, wie sie die geplanten 10 Millionen Touristen dazu bringen wollen, dass sie alle ihr Handy abschalten, darf man gespannt abwarten. Tatsächlich wurden die Menschen ja umgesiedelt, weil Handys in Kilometerabstand und Funkverbindung störend ist.",0,0,0,0,0,0,0,0,0,1,1,1,0
"warum haben ihre Eltern das Haus erworben? Falls geerbt darf man sich nicht beschweren, da man es immer gewinnbringend weiterverkaufen kann.",0,0,0,0,0,0,0,0,0,1,1,1,0
Genau. In der Realität ändert sich wohl (hoffentlich) nicht allzu viel.,0,0,0,0,0,0,0,0,0,1,1,1,0
"Das macht nicht ganz Europa so. Und wenn es Europa machen würde, dann hoffentlich nicht so...dilettantisch.

Es gibt die Kapazitäten für die Tests gar nicht (hat schon der Dezember gezeigt), und wenn wir sie aufbauen (seeehr unwahrscheinlich) dann fehlen in weit sinnvolleren Bereichen. Und 7 (!!!) Tage alte Tests - geht's noch.

Ich verstehe ja dass man die Tests 'fördern ' möchte - aber wäre das nicht irgendwie vernünftig oder mit ein wenig Hausverstand möglich???",0,0,0,0,0,0,0,0,0,1,1,1,0
Wer so einen Schmand hinschlanzt sollte sich nicht wundern wenn er schief angschaut wird. Adios!,0,0,0,0,0,0,0,0,0,1,1,1,0
"Gibt  es Präsidentenwahlen in Saudi Arabien? Offenbar wissen sie nicht, dass Saudi Arabien eine Monarchie ist. Der Vergleich hinkt.",0,0,0,0,0,0,0,0,0,1,1,1,0
"Meins ist es nicht, aber ich freue mich auf den Anblick von Norddeutschen in Lederhosen.",0,0,0,0,0,0,0,0,0,1,1,1,0
"Die Frage der politische Auswirkung können sie völlig unabhängig von der politischen Absicht beantworten. Das ist relevant.

Sie müssen nicht wissen, ob das Nazi-Spiel als rechte oder linke Propaganda entwickelt wurde um die Frage nach der politischen Auswirkung zu beantworten.Die politische Agenda unterscheidet sich von den tatsächlichen Wirkungen meist dramatisch. Die grössten politischen Verbrechen wurden in den idealistischsten Absichten gemacht.

Niemand wird z.B. dem Sozialismus eine böse Absicht unterstellen. Aber die reale Wirkung des Sozialismus ist völlig unabhängig von dieser Absicht zu sehen.

Fazit: Die Frage, ob es sich um eine Propaganda handelt ist nicht relevant. Relevant ist, wie es wirkt.",0,1,0,0,0,0,0,0,0,1,0,1,0
"Und Komplettversagen der Mehrheit der britischen Bevölkerung (der Brexit-Befürworter und jener, die (eher) für die EU waren aber nicht hingegangen sind).

Es ist auch dem Durchschnittswähler zuzumuten, vorauszusehen, dass eine Loslösung des Vereinigten Königreichs von der EU inklusive Binnenmarkt-Exit insbesondere wegen dem Karfreitagsabkommen einer Quadratur des Kreises entsprechen würde.

Sich von diffusen ""Wählt Brexit, wenn ihr euch wegen dieser katholischen Polen nicht mehr als Herren im eigenen Hause fühlt!"" lenken zu lassen, ist halt letztklassig von den Wählern. Sich da auf die politische Klasse rauszureden, ist unredlich.",0,0,0,0,0,0,0,0,0,1,1,1,0
"Schockiert über diese Vorgänge ist eigentlich  jeder vernünftige Mensch, außer die rechten Össis natürlich, denen ist‘s egal wie man am Sonntag wieder gesehen hat.....

Aber es wird noch besser, selbst der Chef der vermeintlichen Aufdecker- und Transparenzpartei der Grünen findet nix dabei - waren ja „nur“ Chatprotokolle?!

Da steht’s als normaler, anständiger Mensch nur mehr ungläubig daneben und schüttelst den Kopf.
Dieses Land geht sowas von den Bach runter. ahhhhh",1,1,1,1,1,1,0,0,0,0,0,0,1
"Also von einem neoliberalen Verein der viele Befugnisse in der Wirtschaft (mit starken sozialen Auswirkungen) hat, aber weniger wenn es um soziales geht.",0,0,0,0,0,0,0,0,0,1,1,1,0
Na zum Beispiel die von Ihnen aus der Werbung der Hiscox genannten Beispiele :-),0,0,0,0,0,0,0,0,0,1,1,1,0
"Nach Prozenten hätten die letzten Wahlen immer die Demokraten gewonnen.
Und weil die Mehrheit der Senatoren republikansich sind, was die Verhältnisse in diesem Land NICHT repräsentiert, bleibt es dabei, dass sich am Wahlsystem NICHTS bessert. Es ist scheinbar Schicksal der USA und dieser Welt, dass es dort NIE wirklich gut läuft. Immer ist es mehr oder weniger ein Desaster für den Rest der Welt, und leider auch für die Mensch en in den USA.

Weg mit diesem Wahlsystem. Die Demokraten müssen das endlich schaffen - irrrrrrgendwie! Die USA müssen befreit werden von diesem total veralteten Mist!",0,0,0,0,0,0,1,1,1,0,0,0,1
Impfungen in den Allerwertesten dürfte es doch geben. Gerade ist einer mit halb heruntergelasserner Hose bei mir vorbei im Austria Center.,0,0,0,0,0,0,0,0,0,1,1,1,0
"Unsinn, direkte Demokratie ist ein Spielball der Kickls und Straches dieser Republik. Solange sich das Wahlvolk derart leicht manipulieren lässt, ist direkte Demokratie eher ein Problem, denn die Lösung.
Schonungslose Aufklärung der Machenschaften der ÖVP und entsprechende Konsequenzen, spätestens an der Wahlurne, wären eine Idee.

Solange aber kurz vor der Wahl ein neuer ""die pöhsen Auslända""-Spin wieder funktioniert, werden wir noch lange Freude an dieser Partie haben.",1,1,1,0,0,0,0,0,0,0,0,0,1
"Der Feind der Demokratie war aber hier der Berliner Senat, der nur noch ihm genehme Demos zulassen wollte. 
Außerdem ist das nur ein Klischee, dass die Demokratie den Feinden der Demokratie die Werkzeuge zu ihrer Zerstörung zur Verfügung stellt. Jede Ausschaltung der Demokratie erfolgte noch durch einen (oder mehrere) undemokratischen Akt der nicht gesetzlich gedeckt war. Im Gegenteil ist es so, dass die demokratischen Prozesse Undemokratische Kräfte zivilisieren und umerziehen, wenn sie nur lange genug darin mitwirken müssen.",1,0,1,0,0,0,0,0,0,0,1,0,1
"Über drüber, die Damen täglich wie am Laufsteg! (Wer ist die Schönste in der ganzen Regierung - die Aschbacher - die noch dazu gütig Almosen medienwirksam an ein Kind verteilt!) 
Abgehoben, arrogant und selbstherrlich die Männerriege!
Was fehlt ist Hausverstand, Erfahrung und eine altersmäßige Durchmischung!
Corona war es jedenfalls nicht wert, ein Land mit all den Kollateralschäden für Jahre an die Wand zu fahren! Da hat die jugendliche Truppe mit ihrem Übermut mit Kanonen auf Spatzen geschossen!",1,1,1,0,0,0,0,0,0,0,0,0,1
"Der Iran ist kein arabisches Land und die Mehrheit des Volkes identifiziert sich nicht mehr als Muslim und will keine Frauenfeindliche islamische Regierung.  Lassen Sie euch bitte nicht täuschen, es waren 1600 Polizistinnen im Einsatz für 4000 Frauen. Sie tun das nur wegen Fifa und nicht dem Volk",0,0,0,0,0,0,0,0,0,1,1,1,0
"ist die Fortsetzung einer jahrzehntelangen Tradition in Oberösterreich, ein Fernbleiben wäre ein Statement. Warum sollte er das aber setzen? Er sieht doch klar, wo die Mehrheiten in Oberösterreich liegen und dass er sich nicht nach rot-grünen Wunschphantasien richten sollte. 

Der Vergleich ist eine Frechheit, weil Frau Schatz Stelzer indirekt unterstellt, ihm wäre die Hasenjagd wurscht. (Abgesehen davon ist sie auch ziemlich konstruiert, weil vermutlich keine zwei Prozent der Bewohner Österreichs ein konkretes Datum zur Hasenjagd auswendig wissen.)",0,0,0,0,0,0,0,0,0,1,1,1,0
"Ein vernunftbegabter Mensch kann in einer Reliquie nur eine kuriose Antiquität sehen. Kulturhistorisch ist das Behältnis interessant, drinnen befindet sich ein x-beliebiges altes Stück Holz, Metall, Knochen oder Fetzen und Zweck ist die Täuschung der Menschen. 
Wie viele Menschen sich da noch hunderte Jahre später täuschen lassen, hat für mich sicher keine mystische Bedeutung, sondern erregt bei mir eben Mitleid und Widerspruch. Ich muss den Irrglauben anderer sicher nicht teilen, gutheißen oder respektieren, insbesondere wenn er so offensichtlich ist, wie bei Reliquien, die einer wissenschaftlichen Untersuchung NIEMALS standhalten.  
Reliquien sind eigentlich auch aus christlicher Sicht Ausdruck von Aberglauben, nicht von Glauben.",0,0,0,0,0,0,0,0,0,1,1,1,0
"1. LASK                              10     21:6       23
2. FC Red Bull Salzburg   10     34:11     22
3. SK Rapid Wien              10     25:14     21",0,0,0,0,0,0,0,0,0,1,1,1,0
"Vielleicht denke ich hier zu pessimistisch, aber ich glaube das ist alles nur Augenauswischerei. Man müsste das ganze System des Kapitalismus überdenken, denn 'Grünes Wachstum' gibt es nicht wirklich. Laut dem klugem deutschen Ökonomen Niko Paech braucht es eine 'Postwachstumsökonomie'. Dass man einfach genügsamer leben müsste, hört man zwar nicht gern, es macht aber viel Sinn.",0,0,0,0,0,0,0,0,0,1,1,1,0
"Delpo zu Andujar: Pass auf, wennst 0-2 hinten bist nimmst die Tabletten da.....",0,0,0,0,0,0,0,0,0,1,1,1,0
"Ich denke, dass man theoretisch sowohl am Land als auch in der Stadt halbwegs verantwortungsvoll bauen könnte. Die Realität sieht halt manchmal anders aus: z.B. bei sogenannten Spekulationsbauten, die an den Bedürfnissen der Eigentümer/Mieter eigentlich vorbeigehen und vermutlich auch an den ursprünglichen Plänen von Architekten und Baumeistern (Betonwüsten statt modernen Wohngebieten). Die planlose Verhüttelung mit verantwortungsloser Versiegelung der Böden ist das Gegenstück dazu. Da werden halt dann die Häuserln inklusive Steingärtchen öfter überschwemmt oder Einheimische können im Heimatort kein Haus bauen, weil die irrwitzig teuren Grundstücke von Investoren gekauft werden.",1,0,1,1,0,0,0,0,0,0,1,0,1
"konservative Frauen sind eben nur zwangsbedingt konservativ, wirklich unbeeinflusste Frauen sind alle links und sind Pro-Abtreibung",0,0,0,0,0,0,0,0,0,1,1,1,0
"Apropos Mond: Wieso hat eigentlich das Imperium nicht einfach den Planeten Yavin zerstört, anstatt darauf zu warten, dass der Mond Yavin 4 in die Sichtlinie kommt?

#neverforget",0,0,0,0,0,0,0,0,0,1,1,1,0
"Es gibt Menschen, die über besondere Fähigkeiten verfügen, wo es keine Ausbildungen gibt, weil diese Fähigkeiten eben besonders sind. Wenn es eine Ausbildung gäbe, wäre es ja nichts besonderes.",0,0,0,0,0,0,0,0,0,1,1,1,0
"Ich kann sehr wohl den Unterschied erkennen, nur hören Sie doch bitte auf zu belehren wenn Sie selbst keine Ahnung haben.

Als erwerbsfähig gelten alle Personen im Regelalter von 15-65 wenn Sie nicht durch Krankheit oder Behinderung beeinträchtigt werden.
Also kommen Sie von Ihrem hohen Ross runter und belehren Sie mich nicht mir falschen Definitionen.

Und nur diese eingeschränkte Grundgesamtheit, so wie Sie es nennen, macht in diesem Fall Sinn, da bei den erwerbsfähigen Personen auch Schüler und Studenten miteinbezogen werden, diese aber auf der momentanen Arbeitsmarktpolitik keine tragende Rolle haben und somit in der Statistik überhaupt nicht von Relevanz ist.",0,0,0,0,0,0,0,0,0,1,1,1,0
"Wenn ichs mir leisten kann, steht heuer glaub ich ein Irland-Urlaub auf dem Programm.",0,0,0,0,0,0,0,0,0,1,1,1,0
"4, 5 jahre einfach nichts gemacht und wir stehen vor derselben situation wie 2015, man packt es einfach nicht.
und was für eine idee, frauen und kinder rauszuholen. die männer sollen sich dann mit wütenden einheimischen prügeln und umgekehrt die einheimischen mit wütenden migranten alleine gelassen werden? man hatte gedacht, all die jahre würde hinter den kulissen am topthema gearbeitet, mit dem wahlen gewonnen wurden, aber es wurde schlicht nichts getan. 50 polizisten mehr irgendwohin zu stellen, ist... man kann es kaum in worte fassen",1,0,1,0,0,0,0,0,0,0,1,0,1
"ich hatte mal eine bekannte, die trank nach dem Aufstehen einen Morgenlatte",0,0,0,0,0,0,0,0,0,1,1,1,0
"Mir hat A1 Anfang 2014 meinen Tarif erhöht - mit dem Hinweis aufs Sonderkündigungsrecht. 3 Monate davor hab ich für unverschämt viele Mobilpoints ein iPhone 5 gekauft und war dann mehrere Tausend im Minus.

Ich bin in den Store gewackelt, hab gefragt, ob es eine Kulanzlösung gibt (z.B. mehr Datenvolumen und ich bleib im Vertrag) und wurde nur deppert angefahren, dass ich entweder mehr zahlen soll oder halt kündigen, wenns mir nicht passt. Hab am selben Tag noch gekündigt, die Mobilpoints waren null und nichtig und das Handy hat mir gehört. Habs dann verkauft und um die Kohle fast ein 5S bekommen - und die Mafia sieht mich nie wieder.",0,0,0,0,0,0,0,0,0,1,1,1,0
"Bitte in meiner ganzen Wohnung riechts nach extrawurst
Ich hab aber seit sicher einem halben Jahr keine gegessen.

Das macht mir Angst",0,0,0,0,0,0,0,0,0,1,1,1,0
"Es haben nicht über 50% bei der Volksabstimmung gegen die Namensänderung gestimmt, sondern 90% dafür. Allerdings war die Wahlbeteiligung bei lediglich 34%, für ein gültiges Referendum wären mindestens 50% nötig. Das war aber von Anfang an nicht entscheidend, denn die Volksabstimmung war unverbindlich. Für die Namensänderung war eine Verfassungsänderung nötig und für diese bedarf es einer 2/3 Mehrheit im Parlament. Niemand hat gesagt das Volk wäre unmündig und beschlossen wurde es von 2/3 der Abgeordneten im Parlament.
Ihre gekauften Abgeordneten entspringen nur dubiosen Verschwörungstheorien. Laut Umfragen unterstützen tatsächlich ca. 84% der Bevöl. den Beitritt zur NATO. Die Opposition (die gegen die Namensä. war) tut dies im Übrigen auch.",0,0,0,0,0,0,0,0,0,1,1,1,0
"Darf neuerdings jeder irgendein Land angreifen und Territurium annektieren wie er lustig ist? 

Nur verlogene Weicheier. Der ganze Wertewesten ist zum Schämen. Besonders die Waffenschieber der EU. Heuchler wo man hinsieht.",1,1,1,0,0,0,0,0,0,0,0,0,1
"Ich auch. Und wenn’s mit den Widerspenstigen 30% der Bevölkerung nicht zurecht kommt’s dann sperrts die endlich ein. Seltsam, dass in der Statistik selten oder nie die bisher Genesenen angeführt sind. Vielleicht ist der eine oder andere ungeimpfte ein Genesener?",0,1,0,0,0,0,0,0,0,1,0,1,0
"Es ist entlarvend zu sehen, wie sehr diese Worte den hohlen Türkislingen wehtun.

Heinz Fischer wurde zwei Mal von einer absoluten Mehrheit der Bevölkerung in sein Amt gewählt und hat dieses 12 Jahre sehr ehrenvoll hinter sich gebracht - davon kann ein türkis fluoreszierender Maturant, der gern ein Kreisky wäre, noch nicht einmal träumen.

Den tatsächlichen Inhalten seiner Rede weiß man als türkiser Propagandamitarbeiter natürlich auch nichts entgegenzusetzen (woher sollte man das auch nehmen?), also bleibt nur die Diffamierung auf tiefster persönlicher Ebene.

Macht euch doch bitte nicht noch mehr lächerlich - mich schmerzt inzwischen sogar schon die Fremdscham.",1,0,1,0,0,0,0,0,0,0,1,0,1
"Schickt denen auch eine Mail wie diese

wien.akademiker@gmx.at

Ihre Mitglieder möchten zur Bildungselite gehören?
Welche Ignoranz herrscht in Ihrem Verein?

Ich hoffe, Sie erhalten eine Ihrer Abgehobenheit und Intelligenzabsenz angepasste Strafe.
Vielleicht lernen Sir es dann.
Auch Bildungselite oder die, die wie in Ihrem Fall sich fälschlicherweise dafür zu  halten scheinen , haben sich an Gesetze und Verordnungen zu halten.",1,0,1,0,0,0,0,0,0,0,1,0,1
"natürlich, aber in kroatien sind sie dann mal in der eu.",0,0,0,0,0,0,0,0,0,1,1,1,0
"Habe ich schon vor zwei Wochen geschrieben (6.1.):
""Man wird stumpf X-Dosen in die Heime anliefern, dort werden viele übrigbleiben und allenfalls kommen dann die Bürgermeister und andere Klüngel noch zu ihrer Spritze, aber niemand aus der Bevölkerung.""
https://www.derstandard.at/story/2000122959056/das-grosse-impfversagen#posting-1065021575",1,0,1,0,0,0,0,0,0,0,1,0,1
"Da möchte ich widersprechen. Macht ist zwar eine Voraussetzung für Korruption, aber nicht jeder, der Macht hat ist korrupt. Es gibt auch anständige Menschen mit Macht und ich hatte das Glück auch ein paar zu kennen.",0,0,0,0,0,0,0,0,0,1,1,1,0
"... intelligent genug, um zu verstehen, dass die Regierung keinen Krieg gegen das eigene Volk führen kann, da es diesen Begriff ""Krieg"" in diesem Zusammenhang gar nicht gibt.

Von Volkes Seiten nennt man diesen Zustand aber ""Unterdrückung"" was auf der anderen Seite nach den Regeln der Logik dann ""Domination"" bedeutet.

Wenn diese andere Seite das Wort ""Domination"" gegen das eigene Volk verwendet, dann ist es ein Synonym für den Krieg gegen das Volk, das dadurch unterdrückt werden soll.

So, jetzt habe ich sie kurz in die Welt der kausalen Logik geführt, falls sie den Zusammenhang überhaupt verstehen. Aber das ist mir bei Trollen wurscht.",0,0,0,0,0,0,0,0,0,1,1,1,0
"Dann soll man das auch zugeben, dass man nix weiß. 

Aber sich wie der Gesalbte hinstellen und einen auf Allwissend und Erhaben machen, PK‘s am laufenden Band zur Egosteigerung durchführen, parteipolitisch agieren und taktieren als ob Wahltag wär und über die Hintertür das asoziale Parteiprogramm durchziehen. 

Die Regierung sollte für alle da sein, nicht für türkise ÖVP Bonzen & geldgeiles Milliardärsanhängsel",1,1,1,0,0,0,0,0,0,0,0,0,1
"Weiter gehts in der Reihe „interessante lifehacks“,
heute mit:

Nicht die övp wählen!

Liebe Grüße,
grunzzz",0,0,0,0,0,0,0,0,0,1,1,1,0
Hat eigentlich der Standard jemals einen solchen Shitstorm aus dem Forum für einen Artikel erhalten?,0,0,0,0,0,0,0,0,0,1,1,1,0
"Weil man Gesichter ""ausrechnen"" kann unter der Prämisse die Gattung zu kennen. Wenn man Gesichter errechnet für eine Gattung die man nicht kennt, dann ist es - jedenfalls in der gezeigten Detailtreue - einfach Spekulation.",0,0,0,0,0,0,0,0,0,1,1,1,0
"Die „Familie“ bringt Schritt für Schritt die letzten Winkel dieses Landes unter ihre Machtkontrolle.

Fortan dient der ÖSV dazu, Propagandabilder für Türkise „Erlöser“ zu erzeugen.

Brot und Spiele für das Volk.
Alle Macht der „Familie“.",1,1,1,0,0,0,0,0,0,0,0,0,1
"""Einmal extrem Rechts - immer extrem Rechts!""

Warum eigentlich? Bei Rechtsextremen ist dieser Vorwurf universell, wer in seiner Jugend in Rechtsextremen Kreisen war, wird für immer stigmatisiert sein. Auch wenn er vielleicht mit zunehmendem Alter ""gescheiter"" wird und nur mehr rechts und nicht mehr radikal ist.

Linksradikalen gesteht man diesen Wandel doch auch zu, siehe  Joschka Fischer, vom Steine Schmeißer zum Außenminister.

Das einzige was links der Mitte akzeptiert wird, sind Aussteiger aus Rechtsextremen Kreisen welche öffentlich mit der Szene komplett brechen.",0,0,0,0,0,0,0,0,0,1,1,1,0
"Das sagt sich so leicht dahin..

Wie hätte es anders laufen sollen? Sie sind auf die Falschen bös. 
Warum schimpfen`s die Italiener nicht?",0,0,0,0,0,0,0,0,0,1,1,1,0
"Die Frage ist so deppat, ich weiß gar ned was ich drauf sagen soll.",0,0,0,0,0,0,0,0,0,1,1,1,0
"Kern übertreibt mit seinen Untergangszenarien bzgl Wirtschaft und China hat man immer belächelt, aber dessen Aufstieg hat sich schon lange abgezeichnet. Besserer Umweltschutz hat noch nie einen Betrieb ruiniert,  aber schlechtes Management und Versäumnisse schon. Mit der Zeit gehen - einige tun es schon.",0,0,0,0,0,0,0,0,0,1,1,1,0
"""Was haben sich die Währungshüter nicht alles ausgedacht in ihrem Elfenbeinturm, dem EZB-Tower in Frankfurt.""

Genau das ist das Problem. Abgehoben und ignorant gepaart mit absoluter Orientierungs- und Ahnungslosigkeit.

Frei nach dem Motto: ""Konsequenz heißt, auch den Holzweg bis zum Rnde zu gehen!""",1,0,1,0,0,0,0,0,0,0,1,0,1
"A: um meinen Versicherungsvertretern ein Geschäft zukommen zu lassen. Ich glaube ich habe die meisten Versicherungen doppelt und dreifach.

B: es könnte unerwartet ja anders kommen

C: haben dann andere im Todesfall noch was davon.",0,0,0,0,0,0,0,0,0,1,1,1,0
"die Regeln sagen halt, dass man raus darf um Bewegung zu machen - ganz ohne Bewegungsradius-Begrenzung. Wo ist also das problem?",0,0,0,0,0,0,0,0,0,1,1,1,0
"Rauch net, kiffe nicht und jeder Spielwarenverkäufer kann ein Auto ungefähr gleich begutachten wie der Blümel ein Budget verstehen. Also was genau passt da nicht?",0,0,0,0,0,0,0,0,0,1,1,1,0
"Klingt alles wie ""slukhi"" also unbestätigteGerüchte. Denn keine Quellenangaben und vor allem viele viele Falschmeldungen im Internet gestreut werden, auch von ""westlichen Quellen"". Also eine Propagandaschlacht wo halt auf gegenseitigen Angriff gegangen wird, würde es hierbei um Deutschland oder USA gehen würde man von Einmischung aus dem Ausland reden, so aber wird hier halt das versucht anders darzustellen.

Man sollte das das den Leuten im Land überlassen, die werden das schon alles regeln und nicht gezielte Propaganda im Ausland betreiben und Gerüchte streuen.",0,0,0,0,0,0,0,1,0,1,0,1,0
"Und da fängt die Ausbeutung ja an, weil was Reinungskräfte so verdienen, das ist schon eine gewaltige Frechheit. 
Aber Lohnerhöhung schmettert die gierige Industriellenvereinigung ja ab, weil die Unternehmer angeblich so arm sind. Die können dann möglicherweise nämlich nicht mehr 5 Porsche, sondern nur mehr 4 Porsche in der Garage haben.",1,1,1,0,0,0,0,0,0,0,0,0,1
"Welche meiner Zahlenangaben über die Volksabstimmung war falsch? Bedarf es bei einer Verfassungsänderung in Nordmazedonien immer einer Mehrheit bei einer gültigen Volksabstimmung oder reicht eine 2/3 Mehrheit im Parlament dafür?

Ist die Mehrheit der Bevölkerung in Nordmazedonien laut Meinungsumfragen für oder gegen den NATO Beitritt?",0,0,0,0,0,0,0,0,0,1,1,1,0
"Das Experiment der Überwindung der Herrschaft des Volkes durch die Herrschaft einer Elite.

Grund- und Freiheitsrechte, welche der Herrschaft erkennbare Grenzen setzen können, sind eine elitäre Idee.

Im Grunde eine antidemokratische Idee, die wir uns immer zurechtgelogen haben, indem wir die Definition von Demokratie solange verzerrt haben, bis sie im Einklang mit dieser Herrschaft der Elite war.",1,1,1,0,0,0,0,1,0,0,0,0,1
"Er hat zwei Lektionen gelernt:
1. Brutale, absolut rücksichtslose Gewalt hilft, auch asymmetrische Kriege zu gewinnen. In Russland ist unabhängige Berichterstattung über eigene Verluste gesetzlich verboten, die Berichterstatter sind de facto Propagandisten des Kremls und des Militärs. Im Westen sitzt einem generell der Staatsanwalt im Nacken, wenn bei Angriffen Zivilisten zu Schaden kommen.

2. Der Westen tut nichts. Er agiert nicht aktiv, weil er Angst hat, und nicht einmal politisch. Die Sozialdemokraten tun sich ja generell schwer, auch nur Kritik zu üben. Dank solche Kreml-Propagandisten wie Gerhard Schröder oder Matthias Platzeck, die ganz offiziell ihr Geld aus Moskau bekommen.",0,1,0,0,0,0,0,0,0,1,0,1,0
"Als Ehemann und Vater einer Tochter kann ich ihnen nur grün geben. Mmn. Ist diese art von Feminismus problematisch weil er auch Frauen bevormunden will und sie somit einer der wichtigsten Errungenschaften berauben möchte   nämlich dass Frauen für sich selbst entscheiden. Alle gleichschalten, keine Kritikfähigkeit, nur mehr safe spaces und wer anders denkt wird durch hysterische Empörung mundtot gemacht. Und so wird Feminismus schön langsam (leider) frauenfeindlich, das Diktat der (vermeintlich) intellektuellen frauen über die restlichen Frauen.",0,0,0,0,0,0,0,0,0,1,1,1,0
"Immerhin könnte durch ihn vieles ans Tageslicht kommen, was man heute noch als Verschwörungstheoretien abtun würde. Epstein war ein Verbrecher, der Kinder missbraucht hat, er hatte Kontakte zu den Clintons, Trump, den Royals, uvm.

Erst gestern habe ich von dem Fa Marc Ditroux gelesen, einfach unfassbar was im Herzen Europas über Jahrzehnte abging, die Pädophilen Eliten wurden oftmals gedeckt oder ließen Zeugen (25 Zeugen, die Informationen zu den Pädoeliten hatten, starben ""zufällig"" an Unfällen, Selbstmord, etc.). Der ganze Fall ist bis heute eine Farce und weitgehend von Medien totgeschwiegen.

Gleiches befürchte ich beim Mord Epsteins, man wird ihn wohl nie klären um die Pädoeliten zu schützen.",1,1,1,0,0,0,0,0,0,0,0,0,1
"Man kann einen Teil des Volkes die ganze Zeit täuschen und das ganze Volk einen Teil der Zeit. Aber man kann nicht das gesamte Volk die ganze Zeit täuschen.
Milwaukee Daily Journal, 29. Oktober 1886",0,1,0,1,0,1,0,0,0,0,0,0,1
