Comment,anti1,anti2,anti3,cent1,cent2,cent3,sov1,sov2,sov3,none1,none2,none3,Populism
"Wer weiss ob Kreysky es heute könnte. Kurz hat begriffen was er kann und vor allem was er nicht kann. Er wird dem Land nie irgendeinen Stempel aufdrücken (können), das ist aber auch nicht sein Ziel. Er will regieren, sonst nichts.",0,0,0,0,0,0,0,0,0,1,1,1,0
"Albot Verdasco muss eine zähe Partie sein, 1:1 nach 26 Minuten...",0,0,0,0,0,0,0,0,0,1,1,1,0
"Sie haben sich also über GILT informiert.   
Dann bitte konkrete Anregungspunkte, was als ""Juxpartie"" von Ihnen empfunden wird. -
Für mich ist DIESE Handhabung der Österreichischen Verfassung nicht mehr im Geiste der Verfassungsprinzipien. Ein Parteiensystem, dass Artikel 1 nicht mal beim Streit in Koalitionsverhandlungen berücksichtigt, sondern sich gegenseitig auf unsere Kosten beschimpft und streitet ist inakzeptabel.  
Nicht einmal die Masse der Bürger, die lieber nicht oder ungültig wählen oder keiner Regierungskoalition das Vertrauen aussprechen wollen, wird als Wunsch nach Systemänderung behandelt. 2 Volksentscheide, 1 Volksbefragung in ca. 70 Jahren ist gegen den Geist der Verfassung. Lösung? -> LESEN",1,1,1,0,0,0,1,1,1,0,0,0,1
"Kurz war ja auch ein gelehriger Zauberlehrling, sein Zaubermeister der Schwarzen Magie Schüssel hat ihn auch in diese Geheimnisse eingeweiht.
Perfektioniert hat Hr.Kurz auch die Magie des reden ohne was zu sagen.
Einziges Manko vom Zauberlehrling ist die Magie der Verantwortung.",0,0,0,0,0,0,0,0,0,1,1,1,0
"Ich kann dir dutzende weitere Zitate von ""Experten"", Journalisten, Politikern und Militärs zeigen, die genau dasselbe behaupten und Russland der Lüge und Propaganda bezichtigen, weil Russland das Gegenteil behauptet. Nun haben wir den Beweis, dass die Russen recht hatten und die USA, die NATO und deren Lakaien gelogen haben. 

Und jetzt, wo dies eindeutig bewiesen ist, ist diese Propaganda des Westens plötzlich nebensächlich, weil ""es eh jeder schon immer wissen konnte"" und weil es sowieso hirnrissig wäre, dieses System zu offensiven Zwecken zu benutzen? Manchmal kommen mir echt Zweifel, ob du wirklich selber glaubst was du erzählst...",0,1,0,0,0,0,0,0,0,1,0,1,0
"bastelte, unter welchem den einen der rote Teppich ausgerollt wird, aber die Normalbürger mit Lügen und Schikanen abgespeist und bevormundet werden. Das ist das Vermächtnis der SPÖ, welches diese Partei bis zum heutigen Tag mit Unwahrheiten verteidigt. Die SPÖ war einmal eine anständige große Partei der Gerechtigkeit und des Fortschritts, aber das ist eine sehr lange Zeit her. Heutzutage geht es den Genossen nur mehr um gut bezahlte Versorgungsposten für die eigenen Parteibonzen, um die lukrativen Nebeneinnahmen beim Verkauf von Doppelstaatsbürgerschaften an reiche Ausländer und um Teil der Elite zu sein.",1,1,1,0,0,1,0,0,0,0,0,0,1
"Soviel zum ""Obervirologen Europas""
Totales Versagen der Experten
- wie zum Beispiel die Oberexperten Europas: ""die Krise habe ein Ausmaß, das ich mir selber nicht habe vorstellen können."" Wieler, Chef des RKI, der Elite in Europa, das Spitzeninstitut schlechthin.
Ein Blick nach China mit einfachsten einfachem Hausverstand im Jänner hätte genügt.",1,1,1,0,0,0,0,0,0,0,0,0,1
"Ich habe gehört, wenn man sich impfen lässt, dann schrumpft man. Stimmt das?         Und warum eichen denn Entwurmungsmittel, Aluhut und mit Knoblauch einreiben nicht aus?
Bitte helfen sie mir.",0,0,0,0,0,0,0,0,0,1,1,1,0
"Nicht nur die Wurstsemmelesser bringt der Herr Überheblich auf die Palme. Einer, der selbstherrlich erschlagt, was nicht in seinen Kram passt, ist wohl nur ähnlich Gesinnten sympathisch.",0,0,0,0,0,0,0,0,0,1,1,1,0
"Gut so. Ein Lakmustest für die Systemparteien. Nicht unüblich in einer Demokratie. Der Bessere möge gewinnen. Das sind derzeit die Systemparteien. In OÖ decken sie derzeit fast 75% ab, die F nicht mitgerechnet. Passt!",0,0,0,0,0,0,0,0,0,1,1,1,0
"Denn üblicherweise unterliegen Politiker Sachzwängen, wirtschaftlich, vertraglich, gesetzliche, diplomatisch ... Heißt, sie können jede Menge Blödsinn versprechen, letztendlich müssen sie das Wohl des Landes berücksichtigen. 

Bei direkter Demokratie stimmen die Leute über Themen ab, von denen sie keinerlei Ahnung haben, ihr Abstimmungsvererhalten aber direkt umgesetzt werden muss. Selbst die erfahrenen Schweizer sind da etwa bei der Freizügigkeitsinitiative reingefallen. Die Regierung musste dann schon ziemlich tricksen, um die Sache so hinzubiegen, dass kein Schaden entsteht. Was aber nicht immer möglich ist ... und auch nicht der eigentliche Sinn der direkten Demokratie.",0,0,0,0,0,0,0,0,0,1,1,1,0
"99,9 % der Schreiberlinge hier wollen nur schreiben und nicht fordern. Mich wundert echt, dass es nicht mehr davon gibt, die wirklich gegen diese Haie wie Kurz, Kogler, Blümel oder Schramböck auf stehen. Für mich sind das richtige Verbrecher, weil wer absichtlich die Wirtschaft und die Tüchtigen in diesem Land töten und gleichzeitig von Menschenleben retten redet, gehört weggesperrt. Die Mafia lässt dich leben wenn zahlst, die kassieren und machen dich trotzdem kaputt. Diese Politik ist zum kotzen",1,1,1,0,0,0,0,0,0,0,0,0,1
"Zur Gedächtnisauffrischung:
2017 macht Strache eine Volksabstimmung über CETA zur Koalitionsbedingung. Gebrochen.
2017 forderte Norbert Hofer ein ""hartes Vorgehen gegen Sozialbetrüger"". Im Frühjahr 2018 wird bekannt, dass Unternehmen, die ihre Angstellten um SV-Beiträge betrügen, nur noch 855 Euro Strafe zahlen müssen.
Die FPÖ forderte verpflichtende Volksabstimmungen, wenn Volksbegehren 250.000 Unterschriften bekommen. Jetzt sind es 900.000, aber erst ab 2022.
Das bereits beschlossene Antirauchergesetz wurde gekippt, weil Koalitionspakt. Was sogar in englischen Pubs funktioniert, geht bei uns nicht? Rund 900.000 Unterschriften sprechen sich gegen das Rauchen in Lokalen aus.
Was Kern angeht, war sein Vergleich schlüssig zur Realität.",0,0,0,0,0,0,0,0,0,1,1,1,0
"sehen halt viele nicht so.

Wer ist die ganze Türkise-Gruppe? 
Derzeit laufen nur Ermittlungen gegen Blümel - sonst keinem aktiven Türkisen.

Bei der SPÖ nur gegen Doskozil - also 1:1.

Sie gehen also schon davon aus, dass alle Minister und Kurz korrupt sind.
Woher haben Sie diese Erkenntnisse?

Wo wäre dann Nehammer korrupt, wo Mag. Karoline Edtstadler,  usw.

Woher wissen Sie, das Novomatic, die ja auch SPÖ bezahlt hat, nicht auch Gelder an andere SPÖ-Politiker gezahlt hat, vll auch an Kern, Bures usw.
Alles möglich.... - Novomatic zahlt alle......

Da lobe ich mir die Türkisen-Wähler, die warten ab, springen nicht auf den Vorverurteilungs-Zug auf und orientieren sich erst dann neu, wenn Anklagen eintreffen.",0,0,0,0,0,0,0,0,0,1,1,1,0
"""Die Ärzte"" gibt es nicht. Gerade bei dieser Zunft gilt eher: ""3 Ärzte - 4 Meinungen"". SCNR 
Nichts desto trotz denke ich, dass eine breitere Mehrheit der Ärzte die Sicherheitsmaßregeln (Maske, Abstand, nicht zuviele Menschen im Raum) unterstützt. 
Die Ausgestaltung in Gesetzen oder Verordnungen ist eine eigene Geschichte, und wäre eigentlich gar nicht erforderlich, wenn die Menschen alle mit Hausverstand und Eigenverantwortung der Situation angepasst umgingen.",0,0,0,0,0,1,0,0,0,1,1,0,0
"Es wäre an der Zeit die MA 48 endlich zu privatisieren. Die so genannte Daseinsvorsorge muss nicht von der Öffentlichen Hand besorgt werden, es würde reichen Sie zu regulieren. Aber dann würden einge Posten für Politiker und deren Günstlinge verloren gehen.",0,0,0,0,0,0,0,0,0,1,1,1,0
"Wenigstens eine Grüne mit Rückgrat. Chapeau!

An alle anderen Grünen in verantwortlicher Position: schämt Euch und ich wünsche Eu h den vollen Absturz bei der nächsten Wahl. Wir brauchen keine grünen Moralapostel die dünkler sind als Schwarz und alle ihre Grundsätze verraten.",0,0,0,0,0,0,0,0,0,1,1,1,0
"Die Leut holen sich take-away (bei McD, Nordsee etc.) und setzen sich dicht gedrängt auf die öffentlichen Bankerl und Sitzmöglichkeiten auf der MariaHÜ. Der Müll stapelte sich schon. 
Wo ist der Unterschied dazu, wenn die Leute stattdessen im ""Schanigarten"" (ebenfalls auf der Straße, gleich neben den Bankerl) dieser Lokale setzen dürften? 
Paradoxe Situation",0,0,0,0,0,0,0,0,0,1,1,1,0
"Das Video ist vom August letzten Jahres, seitdem ist es in Ö und D noch viel schlimmer geworden. 
Ein unglaublich riesiges Polizeiaufgebot heute rund ums Rathaus, überall Absperrgitter, wir saßen nur im Rathauspark in der Sonne und plötzlich war das Verlassen des Areals vor dem Rathaus inkl. Ring und Burg nur mehr hinten bei der  U2-Station durch ein geöffnetes Gitter möglich.
Soviel Polizei überall. 
In London waren letztes Wochenende Hunderttausende auf der Straße, hier wird jeder Protest im Keim erstickt.
Schrecklich.",0,0,0,0,0,0,1,1,1,0,0,0,1
"Ich war das letzte Mal 2018 auf Kuba, was hat sich seither massiv verbessert?
Es stimmt leider nicht alles so wie sie schreiben, die Situation auf Kuba sollte man nicht durch die romantische Brille des Mojito trinkenden Gastes betrachten. 

Die Probleme liegen tiefer. Etwa die Tatsache, dass die gesamte Tourismus Industrie in den Händen der Militärs ist, dass der korrupte Apparat sich bereichert und die Bevölkerung dafür schuftet. Nahezu niemand in seinem Bereich eine Option hat und wirklich gut nur jene leben, die mit Touristen in Kontakt kommen.
Es muss auch viel tun und zwar ein echter Umbruch und eine Loslösung von der korrupten Diktatur.",1,1,1,1,1,1,0,0,0,0,0,0,1
"Ich glaube, dass Schröcksnadel mit dieser selbstgefälligen Wortmeldung den verantwortlichen Politikern einen Bärendienst erwiesen hat. Er macht das Tiroler Desaster noch schlimmer. Und ich hoffe, die Touristen werden nicht so rasch vergessen und bei der Wahl der Destination künftig die Konsequenzen ziehen.",0,0,0,0,0,0,0,0,0,1,1,1,0
"Global denkende und handelnde Menschen wollen so wenige Grenzen wie möglich um sich ungehindert entfalten zu können. Die weniger gut Ausgebildeten oder weniger Erfolgreichen sind viel mehr an einen Ort gebunden und haben durch offene Grenzen mehr Nachteile als Vorteile.
Da in der Politik die Stimmen der einfachen Leute genauso viel zählen wie die Stimmen der  Eliten, werden die Nationalisten immer viel Zulauf haben und sie werden ihre Politik nach den Bedürfnissen ihrer Wähler ausrichten.....Die Demokratie selber ist bei dieser Frage das ""Problem"" der Eliten - und das ist auch 
gut so !",1,1,1,0,0,1,0,0,0,0,0,0,1
"Staatsbürgerschaften sind keine Sammelkarten. Wer Österreicher sein will, hat sich voll und ganz zu diesem Land und seiner Gemeinschaft zu bekennen. Wer hier lebt, Österreicher sein will, hat sich zu entscheiden. Punkt.

...und wer hier nicht lebt, hat sich ebenfalls zu entscheiden. Nur weil es beim Reisen ach so bequem ist einen EU-Pass zu haben, werden wir keine Doppelstaatsbürgerschaft verschenken.",0,0,0,1,1,1,0,0,0,0,0,0,1
"Bisher ist es nur eine Hoffnung, dass schwere bzw. tödliche Verläufe durch eine Impfung verhindert werden. Wissen werden wir es erst viel später - leider. Trotzdem: mein Beileid!",0,0,0,0,0,0,0,0,0,1,1,1,0
"Sie sind ein schönes Beispiel dafür, wie sehr das was an der Oberfläche sichtbar ist, täuschen kann. Es wird bestimmt viele geben, die Sie spontan in eine der Kategorien stecken (zb arrogante sozialinkompetente Karrierefrau) ohne groß nachzudenken, weil es die einfachste Lösung ist. Nur wer sich die Mühe macht hinter Ihre Fassade zu blicken wird sofort verstehen, dass das alles irgendwie Sinn ergibt, selbst die scheinbar zufällige Wahl einer ""Affäre"" fühlt sich angesichts Ihres ""Rucksacks"" stimmig an.  
Mehr Respekt und Interesse für die Rucksäcke unserer Mitmenschen wäre schöner als unsere ewige (moralische) Beurteilerei, von der wir alle dennoch nie ganz wegkommen :-/",0,0,0,0,0,0,0,0,0,1,1,1,0
"Macron ist ein überheblicher Reichenschützer, Sozialstaatshasser, Arbeitnehmerfeind, und Konzern-Lobbyist, genauso wie Kurz. Und Macron will keine wirkliche europäische Integration, sondern eine Europa unter der Vorherrschaft Frankreichs, ganz in der napoleonischen Tradition. Und glauben ein Macron hat keine NLP-Trainer?

Außerdem hat er auch noch den Faschisten und Diktator Philippe Pétain gelobt, das Kurz in aller Öffentlichkeit Dollfuß gelobt hätte, habe ich bei aller Kritik noch nicht von ihm gehört.",1,1,1,0,0,0,0,0,0,0,0,0,1
Kurz setzt seine Flüchtlingspolitik durch - ganz im Sinne einer breiten Mehrheitsmeinung der Österreicher. Was wollen Sie denn mehr? Der Volkswille wird Politik.,0,0,0,1,1,1,0,0,0,0,0,0,1
"Ich bin nicht stolz drauf, aber ich hab heute is erste Mal in meinem Leben bei einem Match abgedreht, weils so scheiße war.",0,0,0,0,0,0,0,0,0,1,1,1,0
"Es gibt unveränderliche Grundwerte der menschlichen Gesellschaft.
Solidarität ist gut, 
Mitgefühl ist gut,
Opferbereitschaft ist gut und Toleranz,
denn alle von uns könnten irgendwann darauf angewiesen sein.

Egoismus hingegen, 
Neid, Geiz und Gier,
Rassismus,
Gewaltbereitschaft,
Kastendenken, (Herrenmenschendenken),
religiöser, ideologischer und nationaler Fanatismus,
Schadenfreude, Mobbing  und Lust am Quälen
sind schlecht für die Gesellschaft.

Das habe nicht ich mir ausgedacht oder irgendein ""weltfremder Bobo"".
Das lehrt uns die Erfahrung, die Geschichte
und unser Hausverstand sollte das ebenfalls tun,
egal, wie viele Idioten uns die Ellbogengesellschaft als ""geil"" verkaufen möchten.",0,0,0,0,0,0,0,0,0,1,1,1,0
"Und an die 200.000 Leute, die nicht zu faul zum Unterschreiben der Petition waren",0,0,0,0,0,0,0,0,0,1,1,1,0
"Ich hoffe es war nicht missverständlich, ich bin voll für Pro-Impfung. Nur die Werbung ist eine Frechheit. Angeblich kostet die ""Baby lass uns impfen"" eine knappe Mio., auch eine Frechheit.",0,0,0,0,0,0,0,0,0,1,1,1,0
"https://www.profil.at/home/bawag-eine-affaere-280315

Und dann wurde aus der Richterin eine Justizministerin auf ÖVP-Ticket und aus dem Staatsanwalt ihr Kabinettschef. Kein Ritual der Welt hätte verhindern können, dass der Bawag-Prozess ab dem Zeitpunkt in der Wahrnehmung als eine Farce mit ÖVP-bestellten Elementen wahrgenommen wurde.",0,0,0,0,0,0,0,0,0,1,1,1,0
"eine parlamentarische Demokratie. unsere Reaktionären Autoritätshörigen sind zu berücksichtigen: Solange es die gibt, darf es hier keine direkte Demokratie geben. Eine Direkte Demokratie hätte Österreich Hitler auch beschert. Die Menschen hierzulande sind überwiegend rechts, intolerant und reaktionär. Und sie glauben an einen ""gnädigen Führer"". Immer schon. Daher: Gott schütze uns vor mehr direkter Demokratie. Sie würde unser Land zugrunde richten.",0,0,0,0,0,0,0,0,0,1,1,1,0
"ernsthaft! glauben, dass Sie ""der Weltmeister"" sind. Bei der Gelegenheit, kennen Sie Rechtssysteme, Stufen der Rechtssysteme, Grundrechte und was sind für Sie Vergehen? Nicht ihren eigenen, subjektiven Horizont (Geist) zu treffen, oder?

Also, dass Sie selbst nicht wissen, dass Sie nichts wissen, völlig weltfremd sind, kann wohl der Bildungsbranche (mehrheitlich wohl im öffentlichen Bereich, öffentliche Protagonisten) nicht (mehr) angelastet werden. Das ist aus Ihrem eigenen Budget, Börserl zu berappen, rückzuzahlen. Wenn auch strafrechtlich diesbezüglich, werden ohnehin mal Sie selbst belangt, wenn Sie angeklagt (StA) werden.",0,0,0,0,0,0,0,0,0,1,1,1,0
"soweit ich mich erinnern kann, ist die ÖVP von 31 auf 34% gestiegen, durch einige
Gesetze - die bei der Mehrheit recht gut ankamen.

Familienbonus, Schulreform usw. - 

https://www.ots.at/presseaussendung/OTS_20181206_OTS0210/1-zeugnis-zu-1-jahr-regierung-in-heute-kurz-enteilt-in-lichte-hoehen

Von 34 auf 38% stieg die ÖVP, weil die SPÖ den MA im NR vorlegte.
Die SPÖ fiel im gleichen Momentan von ca 23% auf 20%.

SPÖ sieht keine Inhalte - der ÖVP Wähler hingegen schon.
Ich sehe auch bei der SPÖ keine Inhalte - ich will Stärkung der Wirtschaft,
Subventionen bei StartUps und eine korrekte Migrationspolitik mit kontrollierter Einreise. Wo bietet hier die SPÖ etwas? Nix - absolute Leere.",0,0,0,0,0,0,0,0,0,1,1,1,0
"Grün für die Offenheit!

Da gehört ja auch was, dazu, sich so zu outen ...",0,0,0,0,0,0,0,0,0,1,1,1,0
"Die Abwertung erfolgreicher Männer, dulde ich nicht. Was erzählen sie da, der Banker hat Gewinne zu erwirtschaften, dass ordentlich Steuer gezahlt werden kann. Das ist die Aufgabe, zb. eines Family Office Banker oder anderer Banker!!!",0,0,0,0,0,0,0,0,0,1,1,1,0
Man sollte nicht alle Tiroler als Gierig und Ausbeuter hinstellen. Es gibt nach wie vor noch sehr viele anständige Menschen in Tirol. Politiker gehören leider nicht zu den anständigen Personen!,1,1,1,1,1,0,0,0,0,0,0,0,1
"Die Katalanen werden sich hüten erneut eine verfassungswidrige Volksabstimmung zu veranstalten. Sie wollen nämlich nicht die EU verlassen müssen - ohne jede Aussicht auf Wiederkehr. Das war den meisten Bürgern dort nämlich nicht bewusst. So wie den Schotten beim letzten Referendum nicht bewusst war, dass sie die EU dank der englischen Chauvinisten zu verlassen haben.
In Schottland hängt die Volksbefragung von der Zentralregierung ab, sie ist also nicht generell verboten. Drum würde auch weder Polizei noch Militär geschickt, wenn eine solide Mehrheit der schottischen Parlamentarier sich hierfür einsetzten. 
Ich denke BoJo und seine Brexit-Boys haben die Folgen des innerbritischen Nationalismus grob unterschätzt. Sie werden dafür bezahlen.",0,0,0,0,0,0,0,0,0,1,1,1,0
Kurz überschreitet rote Linien oder lässt Überschreitungen durch seinen Koalitionspartner unkommentiert zu die sogar einem Politiker vom Schlag des Herrn Pröll zu weit gehen.,0,0,0,0,0,0,0,0,0,1,1,1,0
"Es gibt in jeder Partei Typen, die man privat nicht mal mit der Zange anfassen würde. Allerdings scheinen die gerade in der türkisen ÖVP überhand zu nehmen. Blümel ist einer von ihnen. Die Arroganz tropft ihm sozusagen bei jedem sarkastischen Grinsen aus dem Gesicht. Das hat er mit dem unsäglichen Thomas Schmied gemeinsam. Warum soll man sich auch mit dem Pöbel herstellen? Hanger ein anderer Unberührbarer, wenn auch aus verschiedenen Gründen. Der ist der Pöbel, allerdings anders als Schmied das gemeint hat.",1,1,1,0,0,0,0,0,0,0,0,0,1
"Welche Baufehler? Sind es nicht eher verbesserte/übertriebene thermische Isolierungen und Fenster, die bei Neubauten ein Belüften erforderlich machen?",0,0,0,0,0,0,0,0,0,1,1,1,0
"Ich würds anders ausdrücken: Sanders wird sicher nicht wegen Trump scheitern, Biden sicher nicht wegen dem DNC (das demokratische Establishment).

Biden ist so ziemlich der ideale Kandidat für Trump: ein Wendehals (wollte mehrmals Sozialleistungen kübeln), Lügner (leugnet das, obwohl Videos davon exisitieren), langjähriges Sumpfmonster, zahlreiche Entgleisungen bereits in den Primaries.",0,0,0,0,0,0,0,0,0,1,1,1,0
"„Ich mach mir die Welt widdewiddewie sie mir gefällt“ 

Ihre Bundesregierung!

„Spaß“ beiseite. Ich habe mit der FPÖ nix zu tun, würde diese von oben bis unten korrupte Partei niemals wählen. Aber SO geht man nicht mit Verfassungsrechten um!! 

Es ist eine Frechheit, Österreich wird mehr und mehr zum Basti-Staat!",1,1,1,0,0,0,0,0,0,0,0,0,1
"Diese Debattengrundlage wird nicht ehrlich ausgesprochen, aber die Argumentationen laufen auf das hinaus (dass man nur in Europa sicher ist und hier jeder sein Recht auf Asyl hat)",0,0,0,0,0,0,0,0,0,1,1,1,0
"Wann kapiert ihr endlich das diese rechten „Meinungen“ absolut nichts mit Meinungsfreiheit zu tun hat.

Viel zu lange hat man diesen Leuten zugeschaut  - ihre Lügen und Ihren Rassismus haben sie ungehindert, ungefiltert verbreiten dürfen.
Und damit Menschen beeinflusst die nicht im Stande sind solche Lügen zu entlarven - und das ist leider die Mehrheit der Menschen - und deswegen muss man dagegen etwas machen.

Und Sie unterstützen soetwas - schämen sollten sie sich.",0,0,0,0,0,0,0,0,0,1,1,1,0
"arbeiten. Bäuerinnen noch dazu in der Produktion. Das ist das Dilemma des alten Rollenverhaltens im ""Familienbetrieb"". Verstärkt durch eine Hofübernahmeregelung ( Ausgedinge), die die ""Alten"" zum Gnadenbrot verurteilen. Unwürdig aber Tradition. Die Annäherung an ""gerecht"" beginnt mit der Abschaffung dieser Tradition, verstärkt sich mit der Bewertung "" häuslicher Arbeit"" zu eigenem Einkommen mit eigenen Ansprüchen.Vielleicht brauchts dann keine Plattform ""Bauer sucht Frau"" mehr.",0,0,0,0,0,0,0,0,0,1,1,1,0
wurde h.c. strache mit philippas hündin erwischt. viele haben es mit eigenen augen gesehen.,0,0,0,0,0,0,0,0,0,1,1,1,0
"Sie leben ausschließlich - in einem Reich von Propaganda  und glauben es wäre die Wahrheit, die >reine Wahrheit. Es ist genau umgekehrt. Man hat Ihnen die ´Verschwörung` schmackhaft gemacht, welche die sogenannte Wahrheit, vermittelt durch Medien, den ganzen Tag und jahrelang verbreitet. Da die von Ihnen bekämpfte >andere Seite, als nicht real empfunden wird, ja sogar die Augen vor Vermittlung der widersprechenden Aussagen verschlossen werden, spricht man von TDS (von - Trump - ) Derangement Syndrom. Sie sind dermaßen versessen an ihrem ´traditionellen` Weltbild zu bleiben, dass Sie selbst Inhalte Ihnen widersprechender Quellen nicht ansehen. Google: gibt zu subjektiv zu bedienen https://twitter.com/i/status/1282620176006078465",1,1,1,0,0,0,0,0,0,0,0,0,1
"Hat Weltkarte gekauft.

Hängt Weltkarte auf.

Schwört sich dort hin zu fahren,
wo der Dartpfeil landet.

Dartpfeil landet am Kühlschrank.

Urlaub 2021.",0,0,0,0,0,0,0,0,0,1,1,1,0
"Ich habe mich explizit auf die letzte Wahl und das Ausuählungsverfahren bezogen, nich auf die dem Impeachmentvehrfahren zugrundeliegenden Tatbestände.
Aber danke für die Belehrung! Ich schlage vor Oberlehrer in die engere Berufswahl definitiv miteinzubeziehen...",0,0,0,0,0,0,0,0,0,1,1,1,0
"und auch im Internet gibt es Checklisten für das erkennen eines zu Missbrauch neigenden Partners (auf English hier: https://www.nononsenseselfdefense.com/profile.html ).

Wenn frau sich bloß daran orientieren würde, anstatt auf ""Bad Boys"" reinzufallen, würde sich das von selbst aufhören. Ohne dass eine Frau allen Männern erklären muss, was ein Mann ist.",0,0,0,0,0,0,0,0,0,1,1,1,0
"Bitte was? Die unterschiedliche Behandlung ist überhaupt nicht begründet sondern rein historisch so gewachsen. Falls sie da irgendeine belastbare Quelle haben, posten Sie den Link.

Außerdem stehen die wenigsten Gründerzeitbauten unter Denkmalschutz. Innerhalb des Gürtels stehen die Meisten davon in einer sog. Schutzzone, das hat aber nichts mit Denkmalschutz zu tun. Seit letztem Jahr braucht man eine Bewilligung seitens der Baupolizei, um sie abzureißen. Außerhalb des Gürtels gibts kaum Schutzzonen, da kann sofort abgerissen werden.

Und die Erhaltung zahlt der Eigentümer und nicht der Mieter, Zahlungen in die Instandhaltungsrücklage sind auch lt. MRG nicht auf Mieter umlagefähig. Apropos Humbug..",0,0,0,0,0,0,0,0,0,1,1,1,0
"Das war auch der sinn der hinter. Mir ist es in den letzten wochen massiv auf die nerven gegangen, dass unsere politiker - und eigentlich die meisten politiker weltweit - für ihre Maßnahmen durch den kakoa gezogen wurden. Keinem politiker, keinen mediziner, Wissenschaftler wurde etwas geglaubt - aber jedes youtube video als die einzige wahrheit angesehen. Und eben wurde schweden von diesen experten in den Himmel gelobt - nun kann man ja die ergebnisse vergleichen...",0,0,0,0,0,0,0,0,0,1,1,1,0
"Huch, hab ich mich schon wieder versehentlich bei der Krone eingeloggt. Passiert mir seit neuem immer öfter im Standard.",0,0,0,0,0,0,0,0,0,1,1,1,0
"Geben Sie mir keine Ratschläge, danke, ich bin alt genug zum selber denken und ein ganz simples links rechts Schema ist sowieso immer zu kurz gegriffen. Also auch ihr Links Schema.",0,0,0,0,0,0,0,0,0,1,1,1,0
"Der arme Chris Moser wird seine Lektion mit den Jetzigen schon auch lernen. 
Anhand der Liste Pilz kann man gut sehen, dass politische Parteien ohne Richtung, Strategie und Ideologie zum Scheitern verurteilt sind. Die Liste ist ein komisches, technokratisches Konglomerat, das vermeintliche Expert*innen ins Parlament schicken wollte, weil ja die angeblich bessere Politik machen würden. Dabei ist die Bewegung ein Wahlverein für frustrierte Ex-Grüne, die im Marketingverein der Grünen Partei untergegangen sind und eigentlich das Grüne Technokratentum auf die Spitze getrieben haben. Die Liste eine Zusammensetzung aus Grantlern, die sich unbedingt profilieren wollten.",0,0,0,0,0,0,0,0,0,1,1,1,0
"Man kann bei einem haltungslosen Opportunisten wie Kurz keine anderen politischen Präferenzen haben. Wie soll man gegen jemanden der keinen Standpunkte und Haltung hat opponieren? Man kann Kurz höchstens für unfähig halten, da genügen offene Augen für das was sich im Land abspielt und Hausverstand dass es so nicht weitergehen kann .",1,1,1,0,0,0,0,0,0,0,0,0,1
"Wenn man einmal so ein System aufgezogen hat, bleibt einem auch nichts anderes mehr, als Nebelgranaten abzuschiessen und weiter zu manipulieren. Sonst erhebt sich der enttäuschte Mob gegen einen. Ausserdem glauben die selbst jedes Wort, das sie sagen, weil sie irgendwie eine selbsternannte Elite sind, die den Umsturz geschafft haben.
Und nein, es sind nicht ""die"" Österreicher, aber eine ordentliche Subtruppe. Die egal, ob Haider, Grasser oder Kurz, offenbar ein Idol brauchen, mit dem sie sich identifizieren können, weil sie keine eigene Persönlichkeit haben. Wenn man diverse Interviews in den Bierzelten hört, kann man nur über die Typen traurig sein, die sich da zeigen.",1,0,1,0,0,0,0,0,0,0,1,0,1
"kenn ich mich in der Drogenszene zuwenig aus.

gut, wenn das heute nicht mehr das Geschäft der Mafia ist, dann ziehe ich meine Aussagen zurück.

Die Kokserei der Eliten ist kein Problem. Und der Drogenhandel hat nichts mit der Mafia zu tun.",0,1,0,0,0,0,0,0,0,1,0,1,0
