Comment,anti1,anti2,anti3,cent1,cent2,cent3,sov1,sov2,sov3,none1,none2,none3,Populism
"Ich habe nicht Angst mich anzustecken. Ich habe Angst, dass wir wieder in einen Lockdown schlittern, der uns wieder Abermilliarden kostet. War auch klar ersichtlich, wenn man mehr als nur den ersten Satz gelesen hätte.

Warum ich auf die Ansteckung Bezug nehme? Weil der Vorposter vollkommen untaugliche Vergleiche geliefert hat. Müssen Sie während des Lesens wohl wieder vergessen haben. Aber keine Sorge, das kann schon mal vorkommen, wenn man sich nur auf die Punkte fixiert, die man gerade für ein ""Gegenargument"" braucht um den Diskussionspartner schlecht zu machen. Wozu ich hinzufügen darf: Inhaltlich haben Sie halt wohlweislich nichts zu Erwidern. Ich nehme es zur Kenntnis.",0,0,0,0,0,0,0,0,0,1,1,1,0
"Weil Ärzte und Polizisten nicht bestochen werden müssen, ist das kein Grund, die Korruption in der Parteipolitik kritiklos und tatenlos hinzunehmen.

Bei den Parteien ist die Korruption gerade eben nicht im Griff. Das gesamte Parteiensystem ist so konstruiert, dass es zuviel Macht den Parteiführungen gibt und daher systemische Korruption herrscht. Das spürt man sehr direkt durch instabilität, Regierungsstürze, korrupte Lobby-Entscheidungen (UBER, Artikel 13,...)

Und die Parteien (statt dem Volk) können die Anti-Korruptionsgesetze gegen Parteien  bestimmen...",1,1,1,0,0,0,1,0,1,0,0,0,1
"Wofür? Für seine Beratertätigkeiten? Sein Lobbying?
Gusenbauer ist doch der Kapitalist schlecht hin. Was hat der noch mit dem Sozis am Hut?
Der verkehrt doch nur mehr in Kreisen wie mit Benko...",0,0,0,0,0,0,0,0,0,1,1,1,0
"Ich frage mich ja, wie oft bei diesen Drive-Through-Teststationen die Leute im Scherz einen Big Mac bestellen.",0,0,0,0,0,0,0,0,0,1,1,1,0
"Failed State. Nur gemacht für Bürokraten, Beamte, Politiker. Wobei die weder wirklich  gut sind, noch selbst es wahnsinnig gut haben (ausser die, die meinen das über den korrupten Weg zu machen; geht nicht immer auf, wie wir gerade sehen; oft aber schon). Es ist die Austria Mentalität, besser dem Anderen ans Bein zu pickeln, als eine bessere Lösung zu suchen (bringt ausser einem Hochsteuerland der Sonderklasse, und Giesskannen-Umverteilung, die trotzdem den wenigsten was bringt, wenig). Unternehmer in so einem Land? Ein Wahnsinnsritt ins Ungewisse (ausser halt die, die sich Partei und Politik anbiedern; das läuft natürlich; hochgradig).",1,1,0,0,0,1,0,0,0,0,0,0,1
"Wasserstoffbrennen 10 Millionen Jahre
Heliumbrennen 1 Million Jahre
Kohlenstoffbrennen 10.000 Jahre
Neonbrennen 10 Jahre
Sauerstoffbrennen Wochen
Siliziumbrennen Wochen
Eisenbrennen Tage.

Kommt schlussendlich auf die vorhandenen Mengen an, ist also eher ein Richtwert. Das war ja niemals ein Stern mit soviel Masse. Daher wirds weniger sein und er setzt beim Kohlenstoffbrennen an.

Ein paar dutzend, hundert, vielleicht tausend Jahre. In der Astronomie alles einerlei, ist ein Wimpernschlag.",0,0,0,0,0,0,0,0,0,1,1,1,0
"Völlig egal ob Rechtsaußen oder Linksaußen Aktivisten ein Thema wie den Klimaschutz für ihre Ideologie missbrauchen, dadurch vertreibt man immer die Mehrheit in der Mitte.
Nein, Klimaschutz ist weder ein völkisches Thema noch ein linker Kampf ""gegen Patriachat, Rassismus und Nationalismus"". Er wird dafür nur missbraucht.
Das gibt es auch bei anderen Themen wie Gleichberechtigung, wo man alle Frauen über den Trick der ""Intersektionalität"" für Linksaußen Politik in Geiselhaft zu nehmen versucht. Das letzte Frauenvolksbegehren hat mehr Linksaußen Forderungen als Frauenforderungen darin gehabt und ist deshalb hoffnungslos untergegangen.
Leute denen ein bestimmtes Thema am Herzen liegt, sollten also Linke und Rechte Ideologen davonjagen.",0,0,0,0,0,0,0,0,0,1,1,1,0
"Hans Rauscher hat das in einem seiner Texte als ""Message Control"" beschrieben.  Die permanente  Formung von Narrativen, Aspekte der Realität so zu balancieren, das sie der herrschenden Klasse dienen.  ""Rassismus, Sexismus, böse Republikaner"",..usw..werden bemüht um den eigentlichen Konflikt eines Klassenkampfes zwischen einer immer tyrrannischer agierenden Elite und dem breiten Rest der Menschheit zu vernebeln. Schnittstelle sind hier Medien, die darin unterstützt werden sich konsequent aus ihrer eigenen Verantwortung zu nehmen und so ihre Funktion als bürgerlichen Gegenpol gegen ruchlose Machtinteressen korrumpieren. MMn.",1,1,1,0,0,0,0,0,0,0,0,0,1
"Vor allem gab es damals keinen Sozialstaat, alle mussten arbeiten, um  sich ihren Lebensunterhalt zu verdienen. Und alle wollten auch arbeiten, denn die Städte boten natürlich ganz andere Arbeitsplätze und Möglichkeiten als das Land. 

Und das ist der große Unterschied zur heutigen Zuwanderung: Keine Sprachkenntnisse, bildungsfern, völlig andere Kultur, größtenteils kein Wille, sich in die Gesellschaft einzugliedern, anzupassen, zu arbeiten etc, denn man bekommt alles gratis, was man braucht. Alle Zuwanderer profitieren vom Sozialstaat, den die arbeitende Bevölkerung Österreichs finanziert, ohne selbst auch nur etwas dazu beigetragen zu haben. Und das ist es ua auch, was der Mehrheit der Bevölkerung sauer aufstößt.",0,0,0,1,0,1,0,0,0,0,1,0,1
"Damit Sie Sie endlich Erkenntnis, über was so alles läuft, wo aber tunlichst der mediale Daumen drauf gehalten wird !",1,0,0,0,0,0,0,0,0,0,1,1,0
"Einfach nur scheinheilig. Glaubt er, dass die Leute nicht wegen der F1 den Fernseher bzw. Internet benutzen? Was ist mit den tausenden Zuschauer die zT lange Anfahrtswege haben? Nicht zuletzt der Aberwitzige Aufwand in der Entwicklung usw. usw. 
So viele Jahre ein Teil des Systems und jetzt so tun wollen als ob. Alonso hat schon recht mit seiner Kritik.",0,0,0,0,0,0,0,0,0,1,1,1,0
"für Sie würden, für mich hat und ausreichend Geld am Konto, so einfach ist das.

Im Gegensatz zu solchen Dumpfbacken und Weinbauern im Burgenland, gibt es halt auch Menschen die mit Hirn, Verstand und Rechtsbeistand arbeiten.",0,0,0,0,0,0,0,0,0,1,1,1,0
sicher.... und vorallem der Tag der offenen Tür bei der Bank ist ein beliebtes ausflugsziel,0,0,0,0,0,0,0,0,0,1,1,1,0
Wie er muss arbeuten gehen? Bei einem postiven bescheid sicher nicht,0,0,0,0,0,0,0,0,0,1,1,1,0
"So kann nur ein Roter denken: da ist GELD!!!!!!  Geld gehört prinzipiell der Allgemeinheit also nehmen wir es und verteilen es dorthin, wo am lautesten geschrien wird.

Dass Geld jemand GEHÖRT, der es sich erarbeitet hat, wird ignoriert. Dass derjenige es dann in diesem Staat nicht mehr erwirtschaften  wird, wenn er bloß das Erwirtschaftete an die abliefern soll, die nichts dazu beigetragen haben, wird auch ignoriert. Genauso wie die dann fehlende Bereitschaft, sich überhaupt mehr anzustrengen, wenn man später mit Enteignungen rechnen muss.

Nein. Bloßes Wegnehmen bremst alle Bemühungen. Das geht nur einmal gut, dann sind alle pleite.",0,0,0,0,1,0,0,1,0,1,0,1,0
"Das Wort ""Long Covid"" ist bei österreichischen Maturanten offenbar ein Fremdwort. Und dass es auch Jugendliche trifft, ebenso.
Traurig, der Bildungsstand.",0,0,0,0,0,0,0,0,0,1,1,1,0
"Zeit wird´s. Es ist nämlich sicher gegen die Menschenrechte, wenn die Mehrheit der Geimpften wegen Leuten, die eigenverantwortlich und freiwillig auf eine Impfung verzichten, irgendwelche menschenrechtswidrige Einschränkungen ertragen müssen, nur damit uns die freiwillig Ungeimpften nicht wieder die ICUs verstopfen. Wenn sie sich partout nicht impfen lassen wollen, sollen sie sich doch einfach zu hause einsperren und die Mehrheit der Geimpften frei leben lassen. Alles andere wäre ja eine Diktatur der Ungeimpften und ganz sicher gegen Freiheit, Demokratie und Menschenrechte.",0,0,0,0,0,0,0,0,0,1,1,1,0
"Kein Wunder, dass der auf Krawall gebürstete (""Vasall Putins"") im Weißen Haus auf Eskalationskurs geht.
Rassismus/Pandemie/Atomdeals/WHO...

Es geht immer (nur) ums Geschäft.

ALLE die NICHT zur herrschenden Geldelite gehören,
werden  permanent aufeinander gehetzt oder mit Pipapo beschäftigt und belästigt. Erfolgreich wird jeglicher Anflug einer Chance von change-management in der kollektiven Persönlichkeitsentfaltung unterbunden. Alles, was das big business dieser Elite beeinträchtigen könnte wird eliminiert. Jeder der nicht zu obiger Elite zählt ist ein gegängelter Hamster im Laufrad.
Weder dieser ""aktuelle"" Konflikt noch sonstiger wird mittels Gewalt oder Diskurs zu einer Lösung geführt werden dürfen.
Denn

THE SHOW MUST GO ON!",1,1,1,0,0,0,0,0,0,0,0,0,1
"Ungeimpften. Und der will nicht geschützt werden. Und ich habe, bei aller Liebe, keine Lust, ihn zu schützen. Ich sag's ganz offen:  ich habe meinen Beitrag zur Beendigung der Pandemie mit der Impfung geleistet, das war's...",0,0,0,0,0,0,0,0,0,1,1,1,0
"Einer der stempeln geht ist ein Verlierer, genau. Es gibt genug zu tun und wer nichts kann, kann wohl noch Zeitungen austragen oder Fenster putzen.",0,0,0,0,0,0,0,0,0,1,1,1,0
"Die Aufgabe, einem sechsjährigen Analphabeten Lesen und Schreiben beizubringen ist keine, die sich mit ""Hausverstand"" bewältigen lässt. Das sagt mir MEIN Hausverstand.",0,0,0,0,0,0,0,0,0,1,1,1,0
Ein Einstich muss ja nicht tödlich sein. Er könnte ja dabei auch einen Herzinfarkt erlitten haben.,0,0,0,0,0,0,0,0,0,1,1,1,0
"was spricht denn wirklich dagegen die Vereine jeweils auf ein bestimmtes kleineres Gebiet zu konzentrieren?
macht nicht nur weniger Verkehr, sondern auch noch den Hausärzten die Arbeit einfacher, wenn sie nicht mit einem Dutzend Vereinen kommunizieren müssen, sondern nur mit drei oder vier.",0,0,0,0,0,0,0,0,0,1,1,1,0
"die simple Antwort:

1) Die FPÖ ist bekanntermaßen die neue ""Arbeiterpartei"".

2) Der Akademikeranteil dieser Partei ist daher eher ""überschaubar"".

3) wenn abgesehen von einzelnen Ausreißern (wie zB Zahntechniker) im Grunde die große Mehrheit der ""Farbenstudenten"" einen akademischen Abschluss vorzuweisen hat, verglichen mit den Fans und Wählern dieser Partei (Arbeiterschicht), ist es doch wenig verwunderlich, dass man auf genau dieses Reservoir zurückgreift, wenn es um die Besetzung des Clubs (und von Führungspositionen in den oberen Parteigremien) geht.

vgl. Cartellverband vs ÖVP etc pp

Fazit: irgend an Unberechenbaren setzt keine Partei in den innersten ""elitären"" Club für ihre konspirativen Treffen und Mauscheleien rein, nona.",1,0,0,0,0,0,0,0,0,0,1,1,0
"von Armut und Kastengesellschaft zu verwandeln. Notwendig dazu (man lese ""Ecotopia"") ist die Abschaffung parlamentarischer Demokratie hin zur Despotie und die Rückkehr zu einer Gesellschaft wo der Pöbel wieder seinen ihm zugewiesenen Platz einnimmt. LKW/Taxifahrer als Fahrradkulis als Vision des 21. Jh.s, verdichtete Wohnräume in den Städten, die Landwirtschaft entmotorisiert wo der Bauer und Frau am Feld hocken und das Getreide mit der Sichel ernten, Straßenränder und Dächer werden zur Gemüseversorgung genutzt ganz wie in N-Korea. Die Gesellschaft wird sich in diesem Klimaschutzdespotien wieder in Kasten aufteilen, die die Geld haben dürfen alles, die anderen nichts, der Pöbel wird wieder an seinen Platz verwiesen.",1,1,0,0,0,1,0,0,0,0,0,0,1
"Kurz, Kogler, Anschober und Nehammer haben das ganz alleine verbockt und versuchen nun die Schuld an der ganzen Misere - sowohl gesundheitlich als auch wirtschaftlich - uns Bürgern umzuhängen. Was aber noch viel schlimmer ist: Sie spielen mit Vorurteilen und uns gegeneinander aus: Wer z.B. von der ""Hirnlosigkeit von wenigen ist es ein nicht so großer Schritt zur Arbeitslosigkeit von vielen"" (Kogler) spricht, husst Menschen gegen Menschen auf. Statt Zusammenhalt wird Öl ins Feuer gegossen.

Schämt euch, übernehmt Verantwortung! Ihr habt euch für den Lockdown feiern lassen, jetzt müsst ihr auch für diesen unkoordinierten Herbst/Winter-Fahrplan geradestehen.",1,1,1,1,0,1,0,0,0,0,0,0,1
"Das habe ich anders in Erinnerung. Mein Eindruck damals war, dass die ÖVP (in guter Tradition) einen erfolglosen Chef loswerden wollte und Mitterlehner war damals die einzige Alternative.

Anders im Fall Kurz: hier gierten viele in der ÖVP, durch (korrekte, wie sich gezeigt hat) Umfragen befeuert, nach der Macht - koste es was es wolle (also auch, wenn es dazu notwendig war, einen wertefreien Opportunisten in den Chefsessel zu hieven).",0,1,0,0,0,0,0,0,0,1,0,1,0
"Wie Vollidioten sehen die Minister mit ihren Masken aus, habe aus keinem anderen Land bisher solche Propagandabilder gesehen.

Was die Grünen und der nur noch peinlicher Kogler da mitmachen, geht auf keine Kuhaut.
Es zeigt sich nochmals deutlich, das die Macht brutal korrumpiert und den wahren Charakter der Menschen offenbart.",1,1,1,0,0,0,0,0,0,0,0,0,1
"„Der 51-Jährige könnte psychisch krank sein.“

Ohne jetzt psychisch Kranke verunglimpfen zu wollen, aber wenn jemand absichtlich mit dem Auto Leute tot fährt ist er definitiv psychisch nicht gesund.

Mein Beileid den Opfern.",0,0,0,0,0,0,0,0,0,1,1,1,0
"nein. schon bei der aufarbeitung wurde schnell ersichtlich, dass man den nsu runterspielen musste, um das strukturelle und teils gewollte versagen der behörden zu kaschieren. dass mit hans-georg maaßen ein verkappter rechtspopulist den verfassungsschutz jahrelang leiten konnte zeigt sehr gut, dass selbst in höchsten positionen keinerlei sensibilisierung vorhanden war, dazu brauchte es erst die hetzjagd in chemnitz samt stellungnahme von maaßen.",0,1,1,0,0,0,0,0,0,1,0,0,1
"ja was den sonst? 
Ich finds grad spassig und erfinde eine Gruppierung, deren ich bestimmte Merkmale zurodne anhand ich sie auch noch schlechter behandeln darf, und das alles für ""lalalala""?",0,0,0,0,0,0,0,0,0,1,1,1,0
"Es darf dort kein Art 3 EMRK gegeben sein. Also eine sehr hohe Wahrscheinlichkeit,von einem anschlag getroffen zu werden. Das ist in manchen Gegenden in Afghanistan nicht der Fall. Derzeit werden die Leute nicht nach Kabul, sondern nach mazar verwiesen. Hat der Anschlag dort stattgefunden?",0,0,0,0,0,0,0,0,0,1,1,1,0
"Wenn mir einer mit Propaganda kommt.. Und meint ER selbst hätte mehr begriffen als Ich.. Da muss ich immer laut lachen (: .. 
Erzählens das mit der Propaganda mal den Toten.. Kasperl..",0,0,0,0,0,0,0,0,0,1,1,1,0
"Bots können noch nicht dasselbe wie Menschen - daher ist Personal nötig und ergo bei besonderen Krisen wie dem Mitterlehner-Buch auch knapp. Zudem müssen auch Bots koordiniert werden.

Der Kern des Populismus ist ja zu behaupten, die Meinung des Volkes zu vertreten - exklusiv. Wer anderer Meinung ist, würde sich also gegen das Volk stellen.

So soll der Medienkonsument emotional erpresst werden, auch auf diese Meinung umzuschwenken. Darum ist es oberste Priorität dieser BR, die öffentliche Meinung zu manipulieren.

Oder wozu wären sonst die zusätzlichen 60 PR-Millionen gedacht gewesen?

Dass die Mehrheit hinter dieser BR und ihrer ""Haltung"" steht, halte ich eher für ein Märchen. Das Wunsch-Denk-Risiko schon abgezogen...",1,1,1,0,0,1,0,0,0,0,0,0,1
"Ich weiß nicht einmal ob es zerlegt geliefert wird…das letzte Bett wurde fertig geliefert..also ich lass mich überraschen, zusammenbauen könnte ich ;)",0,0,0,0,0,0,0,0,0,1,1,1,0
"Zum Wasserdampf: ""Warum steht der Wasserdampf nicht stärker im Zentrum der Diskussionen um die anthropogene Klimaänderung Weil der Wasserdampf zwar beim natürlichen, jedoch nicht beim anthropogenen Treibhauseffekt die Hauptrolle spielt. Denn die Atmosphäre nimmt - in Abhängigkeit von ihrer Temperatur - nur eine bestimmte Menge an Wasserdampf auf. Anders ist es beim Kohlendioxid: seit Beginn der Industrialisierung bis in die Gegenwart stieg der CO2-Gehalt der Atmosphäre um rund 35%"" - siehe https://www.umweltbundesamt.de/service/uba-fragen/ist-nicht-wasserdampf-statt-co2-das-wichtigste

'Wollen wir jemals wieder eine Eiszeit?' - dazu muessten die CO2-Konzentration auf zumindest vorindustrielle Werte gesenkt werden ... unwahrscheinlich!",0,0,0,0,0,0,0,0,0,1,1,1,0
"das hab ich mir auch gedacht.
Was machen die, wenn der Wiesberger jetzt das US-Masters gewinnt ?",0,0,0,0,0,0,0,0,0,1,1,1,0
"Aja... Hausverstand auch noch...
Ein ned unbeträchtlicher Teil der Generation Hausverstand, denen ma angeboten hat, Besorgungen für den täglichen Bedarf zu decken oder gar zu bestimmen Uhrzeiten nur einkaufen zu gehen, um das Risiko für sie zu minimieren, san ma immer selbstverantwortlich beim Einkaufen aufm Gnack ummadum greut, weil ma ihnen ja von den hunderten Salathäuptln was wegnehmen könnt oder weil‘s bei der Kassa zu kurz kommen...

Ja, Entschuldigung. Aus mir redt da Frust. Bissi.",0,0,0,0,0,0,0,0,0,1,1,1,0
"Ist DE etwa nicht der AT Koenigsfamilie zur Seite gestanden als es in Sarajevo losging, sondern hat einfach so den WW1 angefangen?
Ist ja schrecklich wie ich als Deutscher immer wieder erleben muss wie ich in der Schule belogen wurde was Geschichte betrifft.
Zum Glueck lese ich ja jetzt den Standard.de und lerne regelmaessig neu.",0,0,0,0,0,0,0,0,0,1,1,1,0
"Korrupte oberste Führungsschicht.
Korrupte mittlere Führungsschicht.

Und darunter: Mitläufer, Leute die mit Waffe und Dienstmarke der starke Mann sein wollen, Leute die aus falsch verstandenem Korpsgeist mitmachen und der Rest will halt nicht aufmucken und selbst zur Zielscheibe werden.",1,1,1,0,0,0,0,0,0,0,0,0,1
Zum Beispiel substantivisch gebrauchte Adjektiva klein schreiben? Gibt schon seltsame Zeitvertreibe.,0,0,0,0,0,0,0,0,0,1,1,1,0
"Mir ist nicht ganz klar wen Sie jetzt genau meinen mit ""solchen Ansichten""?
Den Protestierenden wurde die Meinung ja nicht verboten, oder?
???",0,0,0,0,0,0,0,0,0,1,1,1,0
"Solange eine sog. unabhängige Organisation bei Aleppo den ""Massenmörder"" erkennt, aber nicht gleichzeitig die USA als ""Massenmörder"" betreffend Raqqa (und vielen anderen Städten) beschuldigt, können sie diese einfach als Propagandaorgan in die Tonne schmeissen.

Wissen sie, das würde man wenigsten objektiv nennen können.

Vermute aber, sie werden Zeit ihres Lebens den Unterschied zwischen Information und Propaganda wie Heinrich Müller1 nie erkennen.

So wird da über Raqqa geschrieben. Gerne die Zeilennummer wo von extremen Bombardements, totaler Zerstörung und ganz vielen Toten geschrieben wird.

https://southasiamonitor.org/news/raqqa-liberated-islamic-state-has-gone-but-the-dangers-remain/gwatch/25442",0,1,0,0,0,0,0,0,0,1,0,1,0
"Was ist die Basis der ÖVP? Erzkonservative rechte Gruppierungen, der wohlsituierte Unternehmer? Die Basis sind ganz normale Durchschnittsbürger. Ich behaupte mal, dass die überwiegende Mehrheit der ÖVP-Wähler am Land sich sehr wohl darüber gefreut hätte. Da gibt es nämlich sehr viele Familien darunter, wo die meisten halt nicht realisieren dass sie mit ihrer Stimme für die ÖVP gegen ihre eigenen Interessen wählen.",1,1,0,1,0,1,0,0,0,0,0,0,1
"...kann man recht einfach erklaeren. Der Hass vieler Amerikaner auf das politische Establishment. Die jahrelange Desavouierung von Clinton durch die Republikaner (deswegen haette sie auch nicht kandidieren sollen). Die russische Propaganda fuer Drumpf.
Der zornige weisse Ex-Arbeiter in Detroit findet sicher viel Gefallen daran, dass Drumpf mit seinen Zoellen die lokale Industrie weiter schwaecht. Der entscheidet aber genau so wenig wie Walt Kowalski die Wahl. Das einzig Entscheidende ist die Wahlbeteiligung. Ist die halbwegs gut, dann hat kein Republikaner eine Chance.",0,1,0,0,0,0,0,0,0,1,0,1,0
"Süss, jemand der auf die konstante russophobe Propaganda hereinfällt. Den Kosovo vergessen? Den Irak, Syrien, Lybien, Afghanistan, Somalia, Jugoslawien? Was ist mit dem Putsch in der Ukraine? Den vergessen? Der Poster hat schon Recht, die Russen reagieren sehr zurückhaltend, was sollen sie auch anders machen, Krieg wollen die keinen. Den will immer nur der Wertewesten, lügt, betrügt, foltert, zerfetzt mit seinen Drohnen Millionen Menschen, und willfährige schlechtinformierte Propagandaopfer wie sie eines sind, glauben auch noch den Schmarrn der täglich in den transatlantischen Märchen-Gazetten geschrieben wird. Traurig, sehr traurig...",1,1,1,0,0,0,0,0,0,0,0,0,1
"Und nicht zuletzt trägt Medienförderung das Risiko von Staatsversagen in sich, wenn Eigennutz maximierende Politiker dem Gemeinwohl nur dienen, wenn sie sich daraus einen persönlichen Vorteil versprächen oder von starken Verbänden und Lobbying-Gruppen manipuliert würden. Ist Medienförderung tatsächlich „Korruption“, wie Armin Thurnher, Herausgeber des Falter, verbittert schreibt? „Wer einfach Geld an jene Medien verteilt, die am meisten publizistischen Druck ausüben und am meisten Publicity versprechen, erspart sich nicht nur die Frage, was wirklich fördernswert ist. Er setzt sich auch dem Verdacht aus, die jahrzehntelange korrupte Beziehung zwischen Medien und Politik einfach fortzuschreiben.“ (DER FALTER, 3.4.2020)",1,1,1,0,0,0,0,0,0,0,0,0,1
"Stimmt. Merkel hat dazu nix gesagt. Die hat irgendwann rebelliert. AFAIR war das da, wo sie in Ungnaden fiel und von der hochgelobten Politikerin  zur pösen Führerin degradiert wurde.",0,0,0,0,0,0,0,0,0,1,1,1,0
"Warum nicht?

Sie vergessen ausserdem, dass auch Minister nicht gewählt sind. Nicht einmal Regierungen sind gewählt.",0,0,0,0,0,0,0,1,0,1,0,1,0
"Wers glaubt. Und per du sind wir schon lang nimmer.
Die Mafia ist bipartisan.
Meine Behauptung lautet nicht, die Wahl sei gestohlen, sondern: Die Art, wie rasch und hastig alles abgeschmettert wurde, weil sonst der arme Biden gefährdet gewesen wär, das hat einen eher undemokratischen Eindruck hinterlassen, den sich die Menschen viele Jahre merken werden.
Viel Spass mit Ted Cruz in der nächsten Runde..",1,1,0,1,1,0,0,0,0,0,0,1,1
"Qualitingers Herr Karl war die Darstellung eines feigen, schmierigen Opportunisten. Und das offensichtlich. Das was die Eckhard macht ist dagegen von oben herab, anmaßend und trotz affektiertem Phantasie-Schönbrunnerisch einfach nur ekelhaft. Und nein, das regt nicht zum Reflektieren an wie der Herr Karl.",0,0,0,0,0,0,0,0,0,1,1,1,0
"Will man uns wieder mit den Russen ablenken, oder haben wir keine eigenen Probleme?

Ibiza? Eine ÖVP die Tief im Korruptionssumpf steckt und deshalb kein Interesse an der Aufarbeitung hat? Wir müssen nicht so weit blicken um Dreck zu finden, da reicht Wien durchaus!
Ich hoffe jemand gibt nun endlich das Video frei, also nicht einer unser Abgeordneten die sich ja Geheimhaltungsstufe 4 für diese Farce gefallen lassen (besteht etwa Lebensgefahr oder Gefahr für die Sicherheit?) Das ganze ist wohl eher eine Gefahr für die ÖVP und die Günstlinge dieses korrupten Systems!

Irgendwann baut sich Kurz und Sobotka schon auch so eine angemessene Hütte für ihre harte Arbeit gegen das Volk!",1,1,1,0,0,0,0,0,0,0,0,0,1
"Wenn man mit Mindestlohn, erneuerbare Energien, bessere Vereinbarkeit von Beruf und Familie durch Gratiskindergärten mit längeren Öffnungszeiten, regionale Biolebensmittel für Kindergärten, Schulen und Spitäler, Anstellung von pflegenden Angehörigen und eine schärfere Sicherheitspolitik ein Blauer ist, dann kann sich die SPÖ eh gleich auflösen, oder wofür steht diese Partei dann noch?

Doskozil bringt Themen, mit denen das Leben des Durchschnittsbürger verbessert werden soll.
Die Bundes-SPÖ hingegen ist eine Mischung aus Sesselklebern, KPÖ und radikalfeministischen Splittergruppen. Kreisky würde bei diesen Leuten mit seinem Wirtschaftsslogan ""Leistung, Aufstieg, Sicherheit"" als rechtsextremer Turbokapitalist angesehen werden.",0,0,0,0,0,0,0,0,0,1,1,1,0
Wieso können Sie die Wahrheit nicht ertragen. Das es dort schöne  Häuser mit Pool  gibt und nicht Hütten mit aufblasbaren Pool. Vielleicht schöner als die Hütte in der sie leben.,0,0,0,0,0,0,0,0,0,1,1,1,0
"Wenn das Ministry of Magic dem Antrag auf leihweise Herausgabe eines Timeturners nicht zustimmen sollte, könnte man noch Mary Poppins fragen, ob sie mal wieder an der Uhr von Big Ben drehen würde.",0,0,0,0,0,0,0,0,0,1,1,1,0
"Laut einer schnellen Suche ist das Release-Date der 23.09.2021 - diese Angabe fehlt mir im Artikel. 

Natürlich hab ich schon angefangen die Demo runterzuladen - diesmal auf der PS4 Pro weil ich dort aktuell Mass Effect 1-3 spiele. 

Übrigens gibt es aktuell PS5-Konsolen beim Media Markt - sogar im Online-Store kann man sie kaufen, der Lagerstand ist grün. Allerdings mit Spiderman. Das kann ich nicht gebrauchen, ich werde wohl auf Weihnachten und die Bundles dort warten.",0,0,0,0,0,0,0,0,0,1,1,1,0
"Lunacek ist eine kluge und sympathische Frau. Als Frau in der ersten Reihe habe ich sie aber nach Voggenhuber schon im EU-Parlament als farblos und wenig durchsetzungskräftig erlebt. Als Kulturstaatssekretärin war sie offensichtlich eine Fehlbesetzung.
Dass sie das einsieht, finde ich wieder positiv.",0,0,0,0,0,0,0,0,0,1,1,1,0
"Sie sagen es selbst: so sagt das Gesetz. Wieso sollte man sich nicht an das Gesetz halten?
Sagt der gesunde Menschenverstand denn, dass es ok ist einen eventuell unbeleuchteten Anhängen nieder zu fahren?
Ich denke der gesunde Menschenverstand ist oftmals sogar strenger als das Gesetz.
Natürlich fahren aber auch immer Leute ohne den.",0,0,0,0,0,0,0,0,0,1,1,1,0
"Der Artikel ist einseitig recherchiert und ist eine pauschale Wertung in alle Richtungen und bestenfalls dazu geeignet, die Gesellschaft zu spalten. Die Bildungsmöglichkeiten ab der sogenannten Millennials-Generation war noch nie so gut wie jener der Vorgenarationen. Das Beispiel von einer gescheiterten Banker-Karriere in London ist ja grotesk.",0,0,0,0,0,0,0,0,0,1,1,1,0
